Title,Explain,TestPoint,Answer,OptionA,OptionB,OptionC,OptionD,OptionE,StyleType,AllTestID,ATestID,SrcID,SbjID,CptID,章节名称,科目名称,试题名称
环境污染物危险度评价中的暴露评价可以估计出,"暴露评价用以估计人群对受评物暴露的强度、频率、持续时间，初步了解人群对受试物的暴露情况。
　　【避错】记忆性题。",,E,某化学物在环境介质中的浓度,某化学物对机体产生危害的程度,某化学物是否对机体产生危害,危险物特征,人群对某化学物暴露的强度、频率和持续时间,ATEST,43024608,,3,18,898,历年真题,历年真题,2017年真题第二单元
我国卫生事业的性质是,"我国卫生事业的性质是政府实行一定福利政策的社会公益事业。
　　【避错】记忆性题。",,D,政府实行福利政策的事业,政府通过购买形式为人民提供服务的事业,政府许可的盈利性事业,政府实行一定福利政策的社会公益事业,政府实行的社会公益事业,ATEST,43024609,,3,18,898,历年真题,历年真题,2017年真题第二单元
诊断羊水栓塞的主要病理依据是,"羊水栓塞是由于污染羊水中的有形物质（胎儿毳毛，角化上皮，胎脂，胎粪）和促凝物质进入母体血液循环，引起肺血管栓塞和痉挛。羊水栓塞的证据是在显微镜下观察到肺小动脉和毛细血管内有羊水成分，包括角化鳞状上皮、胎毛、胎脂、胎粪和黏液。也可在母体血液涂片中找到羊水成分。
　　【避错】羊水栓塞是指在分娩过程中羊水突然进入母体血液循环引起急性肺栓塞，过敏性休克，弥散性血管内凝血，肾功能衰竭或猝死的严重的分娩期并发症。",,D,肺泡腔内透明膜形成,肺泡腔内有胎粪小体,肺泡腔内广泛出血,肺血管内有角化上皮,微循环内透明血栓,ATEST,43024610,,3,18,898,历年真题,历年真题,2017年真题第二单元
地塞米松的临床应用不包括,"地塞米松是糖皮质类激素，长期使用可以导致而非治疗骨质疏松。
　　【避错】地塞米松主要用于过敏性与自身免疫性炎症性疾病。如结缔组织病、严重的支气管哮喘、皮炎等过敏性疾病、溃疡性结肠炎、急性白血病、恶性淋巴瘤等。",,D,风湿性心肌炎,感染中毒性休克,过敏性紫癜,骨质疏松,系统性红斑狼疮,ATEST,43024611,,3,18,898,历年真题,历年真题,2017年真题第二单元
下列属于正氮平衡的情况是,"正氮平衡是指氮的摄入量超过排出量。儿童生长发育期、孕妇、哺乳期及康复患者，由于体内需要蛋白质合成新组织，或合成酶和激素以满足生理需要，食入氮量多于排出量，蛋白的合成代谢超过分解代谢，即可出现正氮平衡。
　　【避错】饥饿、食物蛋白质含量少和营养价值低及消耗性疾病患者均可出现氮的负平衡，A、B、D、E均属于负氮平衡。",,C,创伤,饥饿,妊娠,出血,贫血,ATEST,43024612,,3,18,898,历年真题,历年真题,2017年真题第二单元
肠道病毒一般不引起的疾病是,"尿道炎多为致病菌逆行侵入尿道引起，而非肠道病毒感染所致。
　　【避错】肠道病毒包括脊髓灰质炎病毒、柯萨奇病毒和在人类肠道致细胞病变的孤儿病毒（ECHO病毒）。手足口病是由肠道病毒等感染引起的，多发生于春夏季。疱疹性咽峡炎主要由柯萨奇A群及B群病毒引起。",,A,尿道炎,手足口病,脊髓灰质炎,无菌性脑炎,心肌炎,ATEST,43024613,,3,18,898,历年真题,历年真题,2017年真题第二单元
《医疗机构从业人员行为规范》提出的医疗机构从业人员执业的价值目标是,"《医疗机构从业人员行为规范》第4条，以人为本，践行宗旨。坚持救死扶伤、防病治病的宗旨，发扬大医精诚理念和人道主义精神，以患者为中心，全心全意为人民健康服务。
　　【避错】医疗机构从业人员理想的人格形象是大医精诚；医疗机构从业人员的职业道德手段是救死扶伤。",,A,为人民健康服务,发扬人道主义精神,树立大医精诚理念,以患者为中心,救死扶伤、防病治病,ATEST,43024614,,3,18,898,历年真题,历年真题,2017年真题第二单元
依据《精神卫生法》，给予吊销精神科医师执业证书处罚的情形是,"将非精神障碍患者诊断为精神障碍患者，相当于给好人判刑。
　　【避错】《精神卫生法》第75条医疗机构及其工作人员有下列行为之一的，由县级以上人民政府卫生行政部门责令改正，对直接负责的主管人员和其他直接责任人员依法给予或者责令给予降低岗位等级或者撤职的处分；对有关医务人员，暂停6个月以上1年以下执业活动；情节严重的，给予或者责令给予开除的处分，并吊销有关医务人员的执业证书：①违反本法规定实施约束、隔离等保护性医疗措施的；②违反本法规定，强迫精神障碍患者劳动的；③违反本法规定对精神障碍患者实施外科手术或者实验性临床医疗的；④违反本法规定，侵害精神障碍患者的通讯和会见探访者等权利的；⑤违反精神障碍诊断标准，将非精神障碍患者诊断为精神障碍患者的。",,C,未及时对有伤害自身危险的患者进行检查评估的,精神障碍患者对再次诊断结论有异议的,故意将非精神障碍患者诊断为精神障碍患者的,对实施住院治疗的患者未根据评估结果作出处理的,拒绝对送诊的疑似精神障碍患者作出诊断的,ATEST,43024615,,3,18,898,历年真题,历年真题,2017年真题第二单元
观察某种新研制甲肝疫苗的预防效果，研究对象最好选择,"甲肝高发区无免疫人群使用甲肝疫苗，方便检验其预防效果。
　　【避错】接种甲肝疫苗后8周左右便可产生很高的抗体，获得良好的免疫力。因此，甲肝疫苗具有良好的免疫保护作用。凡是对甲肝病毒易感者，年龄在1周岁以上的儿童、成人均应接种，接种本疫苗后可刺激机体产生抗甲型肝炎病毒的免疫力，用于预防甲型肝炎。",,A,甲肝高发区无免疫人群,医院中非肝病区患者,甲肝低发区无免疫人群,医院中血制品接触者,近期曾有甲肝暴发地区的人群,ATEST,43024616,,3,18,898,历年真题,历年真题,2017年真题第二单元
反映均数抽样误差大小的指标是,"标准误，即样本均数的标准差，是描述均数抽样分布的离散程度及衡量均数抽样误差大小的尺度，反映的是样本均数之间的变异，故标准误用来衡量抽样误差。
　　【避错】变异系数是衡量资料中各观测值变异程度的另一个统计量。均数与平均意义相同。标准差定义为方差的算术平方根，反映组内个体间的离散程度。全距也称为极差，是指总体各单位的两个极端标志值之差，可反映总体标志值的差异范围。",,B,变异系数,标准误,均数,标准差,全距,ATEST,43024617,,3,18,898,历年真题,历年真题,2017年真题第二单元
对感染性腹泻进行监测应选择的疾病频率测量指标是,"发病率表示在一定期间内，一定人群中某病新发生的病例出现的频率。是反映疾病对人群健康影响和描述疾病分布状态的一项测量指标。

　　【避错】①罹患率一般用于衡量小范围、短时间的发病频率，以月、周、日或一个流行期为时间单位。可以根据暴露程度精确的测量发病几率，多用于描述食物中毒、职业中毒及传染病的暴发流行。②现患率也称患病率，是指某特定事件内总人口中某病新旧病例。患病率可按观察时间的不同分为期间患病率和时点患病率两种，对慢性病进行现况调查，最适宜计算的指标为患病率。③病死率是表示一定时期内，患某病的全部患者或动物中因该病死亡者所占的比例。",,D,期间患病率,现患率,罹患率,发病率,病残率,ATEST,43024618,,3,18,898,历年真题,历年真题,2017年真题第二单元
主要由自身反应性T细胞介导的自身免疫性疾病是,"髓鞘碱性蛋白（MBP）特异性Th1细胞在小鼠可引起实验性自身免疫性脑脊髓炎，人类的多发性硬化的发病机制与此类似。
　　【避错】①肺出血-肾炎综合征可能系病毒感染和（或）吸入某些化学性物质引起原发性肺损害，由于肺泡壁毛细血管基膜和肾小球基底膜存在交叉反应抗原，非自身反应性T细胞介导。②链球菌感染后肾小球肾炎主要是由于感染所诱发的免疫反应引起，多认为链球菌的胞浆或分泌蛋白的某些成分可能为主要致病抗原，诱发免疫反应后可通过循环免疫复合物沉积于肾小球而致病，肾小球内的免疫复合物导致补体激活、中性粒细胞和单核细胞浸润，引发肾脏病变。",,E,链球菌感染后肾小球肾炎,系统性红斑狼疮,肺出血-肾炎综合征,血小板减少性紫癜,多发性硬化,ATEST,43024619,,3,18,898,历年真题,历年真题,2017年真题第二单元
某地区成年人的首位死因是心脏病，下列各项措施中不属于该地区优先防治策略的是,"大力发展心脏专科医院，为患者提供心脏介入治疗属于二级预防，不是一级预防。
　　【避错】①第一级预防又称病因预防。是指针对病因所采取的预防措施。如果在疾病的因子还没有进入环境之前就采取预防性措施，称为根本性预防。②第二级预防在疾病的临床前期做好早期发现、早期诊断、早期治疗的三早预防工作。对于传染病，还需做到疫情早报告及患者早隔离，即五早。③第三级预防对已患病的患者，采取及时、有效的治疗措施，防止病情恶化，预防并发症和伤残。",,D,通过媒体倡导居民增加身体活动,在社区人群中开展减少心脏病危险因素的咨询,加强公共场所与工作场所的控烟,大力发展心脏专科医院，为患者提供心脏介入冶疗,以高胆固醇血症和家族史为指标,ATEST,43024620,,3,18,898,历年真题,历年真题,2017年真题第二单元
属于影响行为的倾向因素的是,"影响行为的倾向因素，通常是产生某种行为的动机或愿望，或是诱发产生某种行为的因素。主要包括知识、态度、信念及价值观。态度是人们在自身道德观和价值观基础上对事物的评价和行为倾向。
　　【避错】责任是一种职责和任务，身处社会的个体成员必须遵守的规则和条文，带有强制性。法律通常是指由社会认可国家确认立法机关制定规范的行为规则，并由国家强制力保证实施的，以规定当事人权利和义务为内容的，对全体社会成员具有普遍约束力的一种特殊行为规则。",,A,态度,资源,政策,法律,奖励,ATEST,43024621,,3,18,898,历年真题,历年真题,2017年真题第二单元
甘油三酯合成的基本原料是,"甘油三酯合成的基本原料包括甘油和脂肪酸。
　　【避错】人体可利用甘油、糖、脂肪酸和甘油一酯为原料，经过磷脂酸途径和甘油一酯途径合成甘油三酯。",,A,甘油,胆固醇酯,胆碱,鞘氨醇,胆固醇,ATEST,43024622,,3,18,898,历年真题,历年真题,2017年真题第二单元
呈对数正态分布的数值变量资料，描述集中趋势的指标最好选用,"几何均数也称对数平均数，是用于反映一组经对数转换后呈对称分布的变量值在数量上的平均水平。对于变量值呈倍数关系或呈对数正态分布（正偏态分布），如抗体效价及抗体滴度，某些传染病的潜伏期，细菌计数等，宜用几何均数表示其平均水平。
　　【避错】平均数是表示一组数据集中趋势的量数，它是反映数据集中趋势的一项指标。算术均数，简称均数，用于说明一组观察值的平均水平或集中趋势，是描述计量资料的一种最常用的方法。调和平均数又称倒数平均数，是总体各统计变量倒数的算术平均数的倒数，主要是用来解决在无法掌握总体单位数（频数）的情况下，只有每组的变量值和相应的标志总量，而需要求得平均数的情况下使用的一种数据方法。",,A,几何均数,众数,算术均数,调和均数,中位数,ATEST,43024623,,3,18,898,历年真题,历年真题,2017年真题第二单元
下列不参与肝生物转化第二相反应的酶是,"肝生物转化第一相反应主要是氧化、还原和水解反应。肝生物转化第二相反应主要是结合反应。A、B、D、E均为参与肝生物转化第二相反应的酶。
　　【避错】肽基转移酶参与mRNA翻译为肽链的过程，可催化核糖体A位tRNA上末端氨基酸的氨基与P位肽酰-tRNA上氨基酸的羧基间形成肽键。",,C,硫酸基转移酶,谷胱甘肽-s-转移酶,肽基转移酶,葡萄糖醛酸基转移酶,甲基转移酶,ATEST,43024624,,3,18,898,历年真题,历年真题,2017年真题第二单元
肺换气的驱动力是,"肺换气是指肺泡与肺毛细血管血液之间的气体交换过程。呼吸膜两侧气体分压梯度为肺换气的驱动力。
　　【避错】B、C、E均为肺通气的影响因素。",,A,呼吸膜两侧气体分压梯度,呼吸膜气体交换面积,呼吸膜通透性,气体分子与血红蛋白亲和力,气体分子溶解度,ATEST,43024625,,3,18,898,历年真题,历年真题,2017年真题第二单元
符合良性高血压血管病变的是,"细动脉硬化表现为细动脉玻璃样变，是良性高血压病的基本病变。
　　【避错】良性高血压痛也称缓进型高血压病，根据病变进程可将本病分为三期：功能紊乱期、动脉系统病变期、内脏病变期。细动脉玻璃样变属于动脉系统病变期。",,E,小动脉外膜纤维增生,小动脉玻璃样变性,细动脉胶原纤维增生,细动脉平滑肌增生,细动脉玻璃样变性,ATEST,43024626,,3,18,898,历年真题,历年真题,2017年真题第二单元
某人做事总是风风火火，速度很快，脾气暴躁，缺乏耐心，而且时不时会出些错误。其气质类型属于,"胆汁质：反应迅速，情绪有时激烈、冲动、缺乏耐心。
　　【避错】多血质：外向、活泼好动、善于交际；思维敏捷；容易接受新鲜事物；情绪情感容易产生也容易变化和消失、容易外露；体验不深刻等。黏液质：情绪稳定、有耐心、自信心强。抑郁质：内向、言行缓慢、优柔寡断。无多动质类型。",,A,胆汁质,多血质,黏液质,多动质,抑郁质,ATEST,43024627,,3,18,898,历年真题,历年真题,2017年真题第二单元
有权对收受药物经营企业财务的医务人员做出没收违法所得的处罚的单位是,"卫生计生部门行政部门有权对收受药物经营企业财务的医务人员做出没收违法所得。
　　【避错】《中华人民共和国药品管理法》第91条规定：医疗机构的负责人、药品采购人员、医师等有关人员收受药品生产企业、药品经营企业或者其代理人给予的财物或者其他利益的，由卫生行政部门或者本单位给予处分，没收违法所得；对违法行为情节严重的执业医师，由卫生行政部门吊销其执业证书；构成犯罪的，依法追究刑事责任。",,A,卫生计生行政部门,公安机关,食品药品监督管理部门,医师协会,工商行政管理部门,ATEST,43024628,,3,18,898,历年真题,历年真题,2017年真题第二单元
医疗机构临床用血管理的第一责任人是,"《医疗机构临床用血管理办法》第7条规定：医疗机构应当加强组织管理，明确岗位职责，健全管理制度。医疗机构法定代表人为临床用血管理第一责任人。
　　【避错】A、B、C、D选项都不是医疗机构临床用血管理的第一责任人。",,E,临床用血的医师,医疗机构输血科主任,临床用血所在科室的负责人,临床用血医师的上级医师,医疗机构法定代表人,ATEST,43024629,,3,18,898,历年真题,历年真题,2017年真题第二单元
医疗保险制度的资金来源主要是,"医疗保险基金包括社会统筹基金和个人帐户两部分，由用人单位和职工个人按一定比例共同缴纳。
　　【避错】记忆性题。",,B,个人、保险公司、政府,个人、集体、国家,职工、雇主、保险公司,职工、雇主、保险公司,个人、单位、保险公司,ATEST,43024630,,3,18,898,历年真题,历年真题,2017年真题第二单元
下列食物未煮熟时易导致食物中毒的是,"如果四季豆未煮熟，豆中的皂素会强烈刺激消化道，而且豆中含有凝血素，具有凝血作用。此外四季豆中还含有亚硝酸盐和胰蛋白酶，可刺激人体的肠胃，使人食物中毒，出现胃肠炎症状。为了防止出现四季豆中毒，一定要将四季豆煮透、煮熟。
　　【避错】A、B、C、D选项未煮熟时不会引起食物中毒。",,E,赤豆,豌豆,荷兰豆,绿豆,四季豆,ATEST,43024631,,3,18,898,历年真题,历年真题,2017年真题第二单元
，有关DNA碱基组成规律的叙述，错误的是,"DNA的碱基组成规律即Chargaff规则。①所有DNA分子中，嘌呤碱总摩尔数等于嘧啶碱总摩尔数。②DNA的碱基组成具有种属的特异性，即不同生物种属的DNA具有各自独特的碱基组成。③DNA的碱基组成没有组织、器官的特性。④生物体内DNA的碱基组成不受年龄、营养状态和环境的改变等影响。
　　【避错】本题记忆为主。",,D,适用于不同种属,嘌呤与嘧啶分子相等,与遗传特性有关,主要有腺嘌呤组成,不受年龄与营养状态影响,ATEST,43024632,,3,18,898,历年真题,历年真题,2017年真题第二单元
可以引起菌血症的细菌是,"伤寒沙门菌入侵肠黏膜，经淋巴管进入肠道淋巴组织及肠系膜淋巴结继续繁殖，再由胸导管进入血流，引起第一次菌血症。此阶段属潜伏期，患者无症状。伤寒沙门菌随血流进入肝脾、胆囊、骨髓等组织器官内继续大量繁殖，再次进入血流引起第二次菌血症，释放内毒素，产生临床症状（相当于初期），病程第2~3周，伤寒沙门菌继续随血流播散全身，经胆囊进入肠道，大量细菌从粪便排出。
　　【避错】菌血症多是细菌由局部病灶入血，全身无中毒症状，但血液中可查到细菌。毒血症是全身感染的一种类型，是指病原菌在侵入的局部组织中生长繁殖后，只有其产生的外毒素进入血循环，病原菌不入血。外毒素经血到达易感的组织和细胞，引起特殊的毒性症状。A、B、C、D选项均为毒血症。",,E,肉毒梭菌,霍乱弧菌,白喉棒状杆菌,破伤风梭菌,伤寒沙门菌,ATEST,43024633,,3,18,898,历年真题,历年真题,2017年真题第二单元
健康促进的核心策略包括,"健康促进的基本策略分为倡导、赋权、协调和社会动员。社会动员为健康促进的核心策略。
　　【避错】社会动员是通过一系列综合的、高效的动员社会的策略和方法，促使社会各阶层广泛地主动参与，把健康教育、健康促进的目标转化成满足广大社区居民健康需求的社会目标，并转变为社区成员共同的社会行动，进而实现这一社会健康目标的过程。",,C,保护环境,职业卫生,社会动员,疾病控制,学校卫生,ATEST,43024634,,3,18,898,历年真题,历年真题,2017年真题第二单元
肿瘤相关抗原通常不能诱导有效抗肿瘤免疫的原因是,"肿瘤相关抗原多为自身抗原，与正常蛋白差别性很小，故免疫原性弱，无法诱导机体产生足够强度的抗肿瘤免疫应答清除肿瘤细胞。
　　【避错】肿瘤相关抗原是指一些肿瘤细胞表面糖蛋白或糖脂成分，它们在正常细胞上有微量表达，但在肿瘤细胞表达明显增高。此类抗原一般可被B细胞识别并产生相应的抗体。",,C,无诱导抗体产生能力,表达量低,多为自身抗原,MHCⅡ分子表达低,多为T1抗原,ATEST,43024635,,3,18,898,历年真题,历年真题,2017年真题第二单元
在突触传递过程中，触发神经末梢递质释放的关键因素是,"当神经元的兴奋传递到神经末梢时，突触前膜去极化，当去极化达到一定水平后，突触前膜的电压门控Ca[SB2jia.gif]通道开放。Ca[SB2jia.gif]从细胞外进入突触前膜轴浆内，导致轴浆内Ca[SB2jia.gif]浓度瞬时升高，触发突触囊泡出胞。在这一过程中，Ca[SB2jia.gif]的转移很重要。如果减少细胞外Ca[SB2jia.gif]浓度，则递质释放就受到抑制；而增加细胞外Ca[SB2jia.gif]的浓度则递质释放增加。
　　【避错】肌接头由“接头前膜—接头间隙—接头后膜（终板膜）”组成。终板膜上有ACh受体，即N2型ACh受体阳离子通道。当神经纤维传来的动作电位到达神经末梢时，神经兴奋→接头前膜去极化→前膜对Ca[SB2jia.gif]通透性增加→Ca[SB2jia.gif]内流→ACh囊泡破裂释放→ACh进入接头间隙→ACh与终板膜上的ACh受体结合→终板膜对Na[SBjia.gif]通透性增高→Na[SBjia.gif]内流→产生终板电位→总和达阈电位时→产生肌膜动作电位。",,B,末梢内囊泡数量增加,Ca[SB2jia.gif]进入末梢内,末梢膜发生超极化,末梢膜上K[SBjia.gif]通道激活,末梢内线粒体数量增加,ATEST,43024636,,3,18,898,历年真题,历年真题,2017年真题第二单元
慢性肾盂肾炎大体描述正确的是,"慢性肾盂肾炎肉眼观双肾不对称性缩小，可有凹陷性瘢痕，肾盂、肾盏变形。
　　【避错】A项见于慢性肾小球肾炎。B项见于膜性肾小球肾炎。C项见于急性弥漫性增生性肾小球肾炎。",,D,肾弥漫性颗粒状,肾肿大、苍白,肾表面散在出血点,肾不对称性缩小,肾弥漫性肿大,ATEST,43024637,,3,18,898,历年真题,历年真题,2017年真题第二单元
多肽链中肽键的本质是,"肽键是一分子氨基酸的α-羧基和一分子氨基酸的α-氨基脱水缩合形成的酰胺键，即-CO-NH-，氨基酸借肽键联结成多肽链。
　　【避错】磷酸二酯键是两个核苷酸分子核苷酸残基的两个羟基分别与同一磷酸基团形成的共价连接键。二硫键是在肽脱水缩合过程同时，位于两不同肽基上的2个-SH基被氧化而形成的-S-S-形式的硫原子间的键。糖苷键是糖苷分子中糖基和配基的连接键。疏水键是多肽链上的某些氨基酸的疏水基团或疏水侧链（非极性侧链），由于避开水而造成相互接近、黏附聚集在一起，它在维持蛋白质三级结构方面占有突出地位。",,D,磷酸二酯键,二硫键,糖苷键,酰胺键,疏水键,ATEST,43024638,,3,18,898,历年真题,历年真题,2017年真题第二单元
关于DNA变性概念叙述，错误的是,"变性后的DNA具有增色效应，指变性后DNA溶液的紫外吸收作用增强的效应。DNA分子中碱基间电子的相互作用使DNA分子具有吸收260nm波长紫外光的特性。
　　【避错】DNA变性是指核酸双螺旋碱基对的氢键断裂，双链变成单链，从而使核酸的天然构象和性质发生改变。变性时维持双螺旋稳定性的氢键断裂，碱基间的堆积力遭到破坏，但不涉及到其一级结构的改变。凡能破坏双螺旋稳定性的因素，如加热、极端的pH、有机试剂甲醇、乙醇、尿素及甲酰胺等，均可引起核酸分子变性。",,A,变性后260nm波长吸收不改变,变性时两条链解离,变性时二级结构被破坏,变性不伴有共价键断裂,加热可导致变性,ATEST,43024639,,3,18,898,历年真题,历年真题,2017年真题第二单元
免疫缺陷患者不可接种的疫苗是,"凡患有免疫缺陷病、白血病和恶性肿瘤以及因放射治疗、脾切除而使免疫功能受到抑制者，均不能使用活疫苗。
　　【避错】A、B、D、E四种疫苗对于免疫缺陷患者均可接种。",,C,灭活脊髓灰质炎疫苗,流行性出血热疫苗,麻疹活疫苗,多糖疫苗,重组乙型肝炎疫苗,ATEST,43024640,,3,18,898,历年真题,历年真题,2017年真题第二单元
治疗变异型心绞痛的药物是,"钙离子拮抗剂可阻断Ca[SB2jia.gif]内流降低平滑肌细胞内Ca[SB2jia.gif]浓度，能解除冠脉痉挛缓解心绞痛并预防缺血发作，是血管痉挛性心绞痛（即变异型心绞痛）的首选药。
　　【避错】普萘洛尔属于β受体阻滞剂，因其有加重冠脉痉挛的可能，一般不宜用于治疗变异性心绞痛。",,C,多巴胺,肾上腺素,维拉帕米,麻黄碱,普萘洛尔,ATEST,43024641,,3,18,898,历年真题,历年真题,2017年真题第二单元
流行病学研究的观察法与实验法的根本区别在于,"观察法要求观察者对被观察对象不施加任何影响，真实观察并记录；实验法强调根据研究目标的需要而改变试验对象的生活条件，在改变的环境下观察试验对象的行为反应。
　　【避错】流行病学研究方法总体分为：①观察法：包括描述流行病学和分析流行病学；②实验法，也称实验流行病学；③数理法，也称理论流行病学。",,B,盲法,是否有人为干预,统计学检验,设立对照组,不设立对照组,ATEST,43024642,,3,18,898,历年真题,历年真题,2017年真题第二单元
