Title,Explain,TestPoint,Answer,OptionA,OptionB,OptionC,OptionD,OptionE,StyleType,AllTestID,ATestID,SrcID,SbjID,CptID,章节名称,科目名称,试题名称
结核分枝杆菌敏感的理化因素是,"结核分枝杆菌的脂类含量高，对某些理化因子的抵抗力较强，在干痰中可存活6~8个月。对酸、碱、干燥、自然环境有较强抵抗力，但对湿热、紫外线、乙醇的抵抗力弱。
　　【避错】结核分枝杆菌对紫外线比较敏感，太阳光直射下痰中结核分枝杆菌经2~7小时可被杀死，实验室或病房常用紫外线灯消毒，10W紫外线距离照射物0.5~1m，照射30分钟具有明显的杀菌作用。",,C,碱,酸,紫外线,干燥,寒冷,ATEST,43024680,,3,18,898,历年真题,历年真题,2017年真题第二单元
对疑似甲类传染病患者予以隔离所体现的公共卫生伦理原则是,对甲类传染病患者实施强制隔离措施时，应当遵循的公共卫生伦理原则是全社会参与原则。,,E,社会公益原则,互助协同原则,信息公开原则,社会公正原则,全社会参与原则,ATEST,43024681,,3,18,898,历年真题,历年真题,2017年真题第二单元
男，17岁。水肿1周，辅助检查：尿蛋白（+++），尿沉渣镜检：红细胞0~1/HP，24小时尿蛋白定量7.6g，血肌酐76μmol/L，肾穿刺提示微小病变型肾病。其主要发病机制为,"微小病变型肾病的发病机制是T细胞功能紊乱。
　　【避错】补体C3异常多见于急性肾炎，抗基底膜抗体形成为Ⅰ型急进性肾小球肾炎的典型病理表现，免疫复合物沉积多见于Ⅱ型急进性肾小球肾炎。肾小球微血栓形成可见于狼疮性肾炎。",,C,补体C3异常,免疫复合物沉积,T细胞功能紊乱,肾小球微血栓形成,抗基底膜抗体形成,ATEST,43024682,,3,18,898,历年真题,历年真题,2017年真题第二单元
一名45岁的男性，由于患肺结核病而就诊，经问诊得知他已经吸烟20年，每天吸一包烟。他表示考虑在未来一个月内戒烟，作为一名临床医生，你要做的是,"医生对患者戒烟表示肯定和赞许是患者戒烟的强化因素，促进患者戒烟。
　　【避错】强调戒烟的好处，告知吸烟的危害是帮助患者做出戒烟的决定。一般不提倡药物戒烟。",,B,强调戒烟的好处,和病人一起确定戒烟日,提供戒烟药物,随访,告知吸烟的危害,ATEST,43024683,,3,18,898,历年真题,历年真题,2017年真题第二单元
炎热夏季的某一天，气压很低，强烈阳光照射着交通繁忙的城市，一些居民突然出现了不同程度的眼睛红肿、流泪、咽痛、喘息、咳嗽、呼吸困难、头痛、胸闷等症状，导致出现这些症状可能的原因,"强烈阳光照射为二次污染物光化学烟雾。
　　【避错】光化学烟雾是由汽车、工厂等污染源排入大气的碳氢化合物和氮氧化物等一次污染物，在阳光的作用下发生化学反应，生成臭氧、醛、酮、酸、过氧乙酰硝酸酯等二次污染物，参与光化学反应过程的一次污染物和二次污染物的混合物所形成的烟雾污染现象叫做光化学烟雾。人和动物受到主要伤害是眼睛和黏膜受刺激、头痛、呼吸障碍、慢性呼吸道疾病恶化、儿童肺功能异常等。",,C,CO急性中毒,煤烟型烟雾,光化学烟雾,附近火山喷发烟雾,某种传染病流行,ATEST,43024684,,3,18,898,历年真题,历年真题,2017年真题第二单元
女，30岁。呕吐，腹胀5天。神志不清，胡言乱语1天。平素体健。查体：T36.5℃，P90次/分，R18次/分，BP120/80mmHg，巩膜明显黄染，心肺未见明显异常。腹软，无压痛。肝浊音界缩小。实验室检查：血ALT520U/L。TBiL215μmol，DBil138μmol。其典型的肝脏病理改变主要是,"患者急性起病，病情发展迅速，转氨酶和胆红素均升高，考虑为急性重型肝炎。急性重型肝炎的典型病理改变为：肝脏体积缩小，镜下肝细胞坏死广泛而严重，肝细胞索解离，肝细胞溶解，出现弥散性大片坏死。
　　【避错】汇管区纤维化是肝硬化的前期病变。",,B,汇管区纤维化,多个小叶或大块肝细胞坏死,淤血性改变,汇管区中性粒细胞浸润,肝细胞脂肪变性,ATEST,43024685,,3,18,898,历年真题,历年真题,2017年真题第二单元
男，68岁。吸烟、饮酒40多年。有高血压病史。某年冬天晨起时发现左下肢不能动，入院后诊断为脑卒中。以下医生的建议不合理的是,"脑卒中包括脑缺血性和出血性疾病，发病的直接原因是脑部血液供应发生障碍，而非天气寒冷，天气冷为脑血管疾病发病的诱因。
　　【避错】对于脑卒中患者治疗的同时应进行二级预防，控制危险因素，预防再发；通过康复治疗可提高患者的生活质量。",,E,不良生活方式是疾病原因之一，应戒烟限酒,控制血压，预防再发,告知患者定期来医院检查身体,告知患者康复注意事项,告知患者天气太冷是引发该病的直接因素,ATEST,43024686,,3,18,898,历年真题,历年真题,2017年真题第二单元
女，30岁。因慢性皮肤溃疡迁延不愈需接受高压氧治疗。患者对高压氧舱的封闭环境感到十分恐惧。心理医生与患者进行了充分的沟通，在做好各种应急准备之后，让患者直接进入高压氧舱以快速克服恐惧心理。同时完成高压氧治疗。这种心理治疗方法是,"冲击疗法是行为治疗的一种方法，通过直接使患者处于他所恐惧的情境之中，收到物极必反的效果，从而消除恐惧，主要用于恐惧症的治疗。
　　【避错】系统脱敏属于交互抑制，就是每一次只引起患者一点点焦虑，然后用全身松弛的办法去克制它。厌恶疗法是应用惩罚的厌恶性刺激以消除或减少某种适应不良行为的方法。",,B,放松训练,冲击疗法,厌恶疗法,系统脱敏法,认知疗法,ATEST,43024687,,3,18,898,历年真题,历年真题,2017年真题第二单元
梁某的姐姐因患子宫脱垂在某医院接受手术治疗，术后第3天突然死亡。梁某对死因提出质疑，要求复印其姐姐的全部病例资料。医院工作人员依据《医疗事故处理条例》提供了其有权复印的病例资料。以下病例资料中可复印的是,"病例资料中的客观资料可以复印，住院志是客观资料，可复印。
　　【避错】病例资料中的主观资料不可复印，如查房记录、会诊意见等。",,E,会诊意见,上级医师查房记录,死亡病例讨论记录,病程记录,住院志,ATEST,43024688,,3,18,898,历年真题,历年真题,2017年真题第二单元
男，35岁。反复上腹痛5年，再发1个月，加重2天，5年来反复上腹痛，多发生于饥饿时，进食及口服碱性药可缓解，1个月来再发上腹痛，口服碱性药物缓解不满意，2天来上腹痛加重向后背放射，查体：上腹部压痛。血清淀粉酶320U/L，该患者最可能的诊断是,"患者有典型的饥饿痛（疼痛-进食-缓解），为十二指肠溃疡。十二指肠球后溃疡，溃疡多在后内侧壁，可穿透入胰腺，致疼痛加重，淀粉酶升高。
　　【避错】胃及十二指肠球部溃疡均可出现规律上腹部疼痛。胃溃疡（GU）多在餐后痛，十二指肠溃疡（DU）表现为饥饿痛，进食后缓解，约半数患者有午夜疼痛。",,E,十二指肠球前壁溃疡,胃窦溃疡,胃底溃疡,胃体溃疡,十二指肠球后壁溃疡,ATEST,43024689,,3,18,898,历年真题,历年真题,2017年真题第二单元
为保障工人的健康，预防职业病的发生，按照《职业病防治法》的要求，某化工厂定期进行生产环境监测，为工人进行健康检查，建立健康档案并定期分析。以上所做的工作为,"健康监护是通过各种检查和分析，掌握职工健康状况，早期发现健康损害，以评价职业性有害因素对接触者健康的影响及其程度。
　　【避错】生物监测是利用生物个体、种群或群落对环境污染或变化所产生的反应说明环境污染状况，从生物学角度为环境质量的监测和评价提供依据。",,D,职业流行病学研究,现场劳动卫生学调查,生物监测,健康监护,职业危险风险评估,ATEST,43024690,,3,18,898,历年真题,历年真题,2017年真题第二单元
男，78岁。反复咳嗽、咳痰50年，心悸、气促10年，再发10天。吸烟40年，30支/日。查体：T36.0℃，P120次/分，R32次/分，BP135/80mmHg，SpO[XB2.gif]87%（吸氧）。桶状胸，肋间隙增宽，两侧呼吸运动对称，触觉语颤减低，胸部叩诊呈过清音，双肺呼吸音减弱，双肺可闻及细湿啰音和少量哮鸣音。动脉血气分析示pH7.38，PaO[XB2.gif]50.4mmHg，PaCO[XB2.gif]56.8mmHg，肺功能检查：FEV[XB1.gif]占预计值27%，FEV[XB1.gif]/FVC34%，该患者不宜吸入高浓度氧的原因是高浓度可解除,"老年男性，有吸烟史，反复的咳、痰、喘诊断为慢性支气管炎，查体有肺气肿体征，血气分析提示Ⅱ型呼衰，FEV[XB1.gif]/FVC<0.7，已经进展为COPD急性加重期，应该采用低流量吸氧，防止血氧含量过高。
　　【避错】CO[XB2.gif]潴留是通气功能不良的结果，慢性高碳酸血症患者呼吸中枢的化学感受器对CO[XB2.gif]反应性差，呼吸主要靠低氧血症对颈动脉体、主动脉体化学感受器的刺激来维持。若吸入高浓度氧，使血氧迅速上升，解除了低氧对外周化学感受器的刺激，便会抑制患者呼吸，造成通气状况进一步恶化，CO[XB2.gif]上升，严重时陷入CO[XB2.gif]麻醉状态。低氧刺激外周化学感受器；CO[XB2.gif]刺激中枢化学感受器。",,D,外周化学感受器对低氧存在的适应现象,低氧对呼吸中枢的直接兴奋作用,中枢化学感受器对低氧存在的适应现象,低氧对外周化学感受器的兴奋作用,低氧对中枢化学感受器的兴奋作用,ATEST,43024691,,3,18,898,历年真题,历年真题,2017年真题第二单元
研究者欲比较两种中成药对口腔溃疡的治疗效果是否有差别，用“有效、一般、无效”作为评价疗效的指标。宜采用的统计分析方法是,"秩和检验是一种常用的非参数统计方法，适用于非正态分布或分布类型不清楚的资料，不能准确测量，只能以严重程度等表示的等级资料。
　　【避错】t检验主要用于样本含量较小（例如n<50），总体标准差未知的正态分布资料。方差分析是从观测变量的方差入手，研究诸多控制变量中哪些变量是对观测变量有显著影响的变量。当已知标准差时，验证一组数的均值是否与某一期望值相等时，用Z检验。回归分析是确定两种或两种以上变量间相互依赖的定量关系的一种统计分析方法。",,D,t检验,方差分析,Z检验,秩和检验,回归分析,ATEST,43024692,,3,18,898,历年真题,历年真题,2017年真题第二单元
男，45岁。湖北渔民，经常腹痛、腹泻，体力逐渐下降半年，当地有类似患者。查体：体温正常，慢性病容，腹膨隆，脾肋下2cm，移动性浊音（+），血常规：Hb90g/L，WBC2.5×10[SB9.gif]/L，N0.6，本患者所患疾病的病理特点是,"渔民出现腹泻症状，且当地有类似患者症状，应考虑日本血吸虫。日本血吸虫病是由日本血吸虫寄生于门静脉系统所引起的疾病，由皮肤接触含尾蚴的疫水而感染，主要病变为虫卵沉积于肠道和肝脏等组织引起的虫卵肉芽肿。急性期患者有发热、腹痛腹泻或脓血便，肝大与压痛，血中嗜酸性粒细胞显著增多。慢性期患者以肝脾大或慢性腹泻为主。晚期则以门静脉周围纤维化病变为主，可发展为肝硬化、巨脾、腹水等。
　　【避错】门静脉血栓形成的病因很复杂，主要有炎症性、肿瘤性、凝血功能障碍性、腹腔手术后、外伤性及原因不明性等。25%~30%的成人门静脉血栓病例继发于肝硬化。肝细胞坏死及假小叶形成见于肝硬化。干酪样坏死见于结核病变。",,C,门静脉血栓形成,肝细胞坏死及假小叶形成,肝内门静脉周围纤维化,肝静脉血栓形成,干酪样坏死,ATEST,43024693,,3,18,898,历年真题,历年真题,2017年真题第二单元
女，45岁。体检发现右乳肿块，直径2cm，活动度差，边界不清。术后病理可见乳腺间质中有串珠样单行癌细胞排列。最可能的诊断是,"乳腺癌中小叶浸润癌由小叶原位癌穿透基底膜向间质浸润所致，主要特点是浸润的癌细胞在间质中呈单行串珠状。
　　【避错】①导管原位癌即导管内癌，发生于乳腺中小导管，癌细胞局限于不同程度扩张的导管内，管壁基底膜完整。②小叶原位癌，癌细胞局限于管泡内，未穿破其基底膜，小叶结构存在。③乳腺浸润性导管癌中癌组织呈条索或岛屿状分布，在间质内浸润性生长。④髓样癌由明显异型的大细胞组成，伴有大量淋巴细胞浸润。",,C,导管原位癌,小叶原位癌,小叶浸润癌,髓样癌,导管浸润癌,ATEST,43024694,,3,18,898,历年真题,历年真题,2017年真题第二单元
为加强妇女保健工作，某大型企业组织全体女职工进行健康检查，采用快速的医学检查方法，从表面健康的女职工中查出乳腺癌和宫颈癌的可疑患者，再进一步确诊后给予早期治疗，这种疾病防治策略属于,"疾病筛查就是运用快速、简便的体格检查或实验室检查以及危险因素监测与评估等手段，在健康人群中发现未被识别的患者或有健康缺陷的人。目的是将处于早期或亚临床阶段的患者、缺陷者及高危个体从人群中挑选出来。
　　【避错】记忆型题。",,B,早期特异预防,疾病的筛检,高危人群的健康体检,重点疾病的抽样调查,一般健康促进,ATEST,43024695,,3,18,898,历年真题,历年真题,2017年真题第二单元
男，45岁。因焦虑症接受心理治疗，在治疗过程中患者多次约治疗师看电影，并多次打电话叮嘱治疗师“可能下雨要带雨伞”或者“气温下降要添加衣服”等。患者的这种表现是,"移情是治疗者把过去某些重要人物的情感移植到治疗师身上，从而重新处理早期未能解决的冲突，使问题有可能得到积极有利的解决。
　　【避错】“阻抗”是一种无意识的心理过程，其目的是阻止受压抑的冲突意识化。“象征”即用一种中性事物来替代一种忌讳的事物可减少或避免引起梦中自我的痛苦或创伤。“投射”指在梦中将自己某些不好的愿望与意念，投射于他人，而减轻对自我的谴责。“认同”是指个体向比自己地位或成就高的人的认同，以消除个体在现实生活中因无法获得成功或满足时而产生的挫折所带来的焦虑。",,B,象征,移情,认同,阻抗,投射,ATEST,43024696,,3,18,898,历年真题,历年真题,2017年真题第二单元
男，45岁。因“胃溃疡”行胃部分切除术，卧床7天后出现高热，咳脓血痰伴气促。查体：T39℃，P120次/分，R30次/分。双肺可闻及少许湿啰音。痰液涂片检查可见大量脓细胞，成堆排列的G[SBjia.gif]球菌，白细胞内也可见G[SBjia.gif]球菌。最可能感染的细菌是,"患者高热、咳脓血痰，痰培养可见大量脓细胞并成堆排列的革兰阳性球菌考虑为金黄色葡萄球菌感染。
　　【避错】脑膜炎奈瑟菌为革兰阴性双球菌。肺炎链球菌感染常见砖红色胶冻样痰，而非脓血痰。",,A,金黄色葡萄球菌,D族链球菌,A族链球菌,脑膜炎奈瑟菌,肺炎链球菌,ATEST,43024697,,3,18,898,历年真题,历年真题,2017年真题第二单元
男，45岁。双上睑下垂伴四肢无力1年，晨轻暮重。治疗过程中出现呼吸困难、多汗、流涎、瞳孔缩小，最可能的原因是,"上睑下垂、四肢无力、晨轻暮重考虑重症肌无力。多汗、流涎、瞳孔缩小为胆碱能系统亢进表现。
　　【避错】重症肌无力治疗应用胆碱酯酶抑制剂，过量可出现胆碱能系统亢进症状。5-HT系统亢进可见瞳孔扩大。肾上腺能系统亢进典型表现为满月脸、水牛背、向心性肥胖、多血质、腹部可见紫纹、高血压等。",,E,5-HT系统亢进,重症肌无力危象,胆碱能系统抑制,肾上腺素能系统抑制,胆碱能系统亢进,ATEST,43024698,,3,18,898,历年真题,历年真题,2017年真题第二单元
心理评估师给患者进行心理评估时，向患者出示了三张意义含糊的图片，并请他根据对图片内容的理解讲一个较为完成的故事，医生由此可以推测患者的个性特征和心理问题。该测验方法属于,"投射法是指个人把自己的思想、态度、情绪或特征等，不自觉地反应于外界的事物或人的一种心理作用。测试所用的刺激多为意义不明确的各种图形或数字，让受测者在不受限制的情境下，自然做出反应，由对反应结果的分析来推断受测者的人格。
　　【避错】记忆型题。",,D,调查法,作业法,观察法,投射法,问卷法,ATEST,43024699,,3,18,898,历年真题,历年真题,2017年真题第二单元
女，30岁。腹痛、腹泻伴里急后重3天。最初为稀便，2天后为黏液脓血便，偶见片状灰白色膜状物排出。此病变最可能的炎症类型是,"腹痛伴里急后重，排黏液脓血便考虑为细菌性痢疾，细菌性痢疾属于纤维素性炎症。
　　【避错】①变质性炎症主要特征是组织细胞内发生严重的变性，坏死，而渗出和增生过程则较轻微。②出血性炎特征为血管损伤严重，渗出物含大量红细胞，常见于流行性出血热，钩端螺旋体病和鼠疫等。③浆液性炎症是以浆液渗出为主的炎症，好发于黏膜、浆膜、疏松结缔组织，发生于黏膜者可引起浆液性卡他性炎。④化脓性炎是以中性白细胞大量渗出为主并伴有不同程度的组织坏死和脓液形成的炎症。",,A,纤维素性炎,变质性炎,出血性炎,浆液性炎,化脓性炎,ATEST,43024700,,3,18,898,历年真题,历年真题,2017年真题第二单元
男，25岁。高热1周，头疼，呕吐，血常规Hb87g/L，WBC33.2×10[SB9.gif]/L，Plt56.0×10[SB9.gif]/L，骨髓细胞学检查见分类不明的原始、幼稚细胞占0.82，为鉴别该细胞的来源，目前最准确的检查技术是,"骨髓有核红细胞占全部有核细胞20%以下，原始细胞≥30%，诊断为急性白血病。该患者现出现头痛、呕吐等中枢神经系统受侵症状，急性白血病中容易侵犯中枢神经系统的类型是急性淋巴细胞白血病，该病首选的检查是糖原染色。
　　【避错】①急淋白血病糖原染色阳性呈块状。②急粒白血病髓过氧化物酶强阳性。③非特异性酯酶阳性，能被NaF抑制>50%，见于急单白血病。",,B,细胞非特异性脂酶染色,细胞糖原染色,流式细胞术检查,染色体检查,细胞髓过氧化物酶染色,ATEST,43024701,,3,18,898,历年真题,历年真题,2017年真题第二单元
男，68岁。反复咳嗽，咳痰20余年，气短5年。患者长期使用吸入糖皮质激素及支气管舒张剂治疗，近1周症状控制欠满意，联合使用某药物治疗后，出现排尿困难。该患者近来增加的药物最可能的,"患者老年男性反复咳嗽咳痰20余年，气短5年考虑诊断为慢性阻塞性肺疾病，治疗应使用支气管扩张药。M受体拮抗剂的副作用是尿潴留、排尿困难，所以前列腺增生患者慎用M受体拮抗剂。
　　【避错】氨茶碱的全身副作用包括对中枢神经的和心脏的兴奋作用，不会出现尿潴留。β[XB2.gif]受体激动剂通过兴奋气道平滑肌和肥大细胞膜表面的β[XB2.gif]受体，舒张气道平滑肌、减少肥大细胞和嗜碱性粒细胞脱颗粒及其介质的释放、降低微血管的通透性、增加气道上皮纤毛的摆动等缓解哮喘症状。",,B,茶碱类,M受体拮抗剂,β[XB2.gif]受体激动剂,口服糖皮质激素,祛痰,ATEST,43024702,,3,18,898,历年真题,历年真题,2017年真题第二单元
男，57岁。心前区疼痛2年，多于安静状态发生，近日于睡眠中突发心前区疼痛。查心电图ST段抬高，冠脉造影见一过性狭窄。予硝苯地平治疗的主要药理学依据是,"该患常睡眠中突发心前区疼痛，心电示ST段抬高，冠脉造影可见一过性狭窄，考虑为变异型心绞痛。变异型心绞痛治疗首选硝苯地平。
　　【避错】变异型心绞痛特征为静息心绞痛，表现为一过性ST段呈弓背向上抬高。其发病机制是冠状动脉痉挛。由于钙拮抗剂能阻断血管平滑肌细胞钙离子内流，扩张冠状动脉，解除冠状动脉痉挛，增加冠脉血流量，故临床上将其作为变异型心绞痛患者的首选药物。",,A,选择性扩张外冠状动脉，增加心肌供血,显著减慢心率，降低心肌耗氧量,选择性增加心内膜膜下心肌供氧,显著抑制心肌收缩力，降低心肌耗氧量,抑制或逆转心肌肥厚，降低心肌耗氧量,ATEST,43024703,,3,18,898,历年真题,历年真题,2017年真题第二单元
男，70岁。因脑出血1小时入院，病情危重。医生建议立即手术，并告知家属手术可能存在的风险，不手术则会有生命危险。家属因经济困难，示意医生只需作简单处置，放弃救治，听任其死亡，但拒绝对此签字。此时医生应选择的最佳决策是,"根据《医疗机构管理条例》无法取得患者意见又无家属或关系人同意时，经治医师应当提出医疗处置方案，在取得医疗机构负责人或者被授权负责人员的批准后实施。
　　【避错】自己处理不了的事情应该及时向上级领导汇报，请示上级领导的处理意见。",,C,一定要家属签字，否则让患者转院,听从家属决定，并在病历上如实记录家属意见,征求医院领导意见并与家属充分沟通，确定符合实际的救治手段,提请法院作出决策,不考虑家属意见，医生直接手术,ATEST,43024704,,3,18,898,历年真题,历年真题,2017年真题第二单元
男，12岁。因频发时轻时重的口吃就诊，经晤谈，心理治疗师认为患儿的口吃症状与其父母感情不好，总在他面前争吵并动辄以离婚相威胁有关，遂要求三人一起接受心理治疗，并采用了循环提问等技术，该心理治疗法称为,"家庭疗法，是以家庭以对象而施行的心理治疗方法。协调家庭各成员间的人际关系，通过交流，扮演角色，建立联盟，达到认同等方式，运用家庭各成员之间的个性、行为模式相互影响互为连锁的效应，改进家庭心理功能，促进家庭成员的心理健康。该治疗方法适用于家庭危机、子女学习困难，子女行为障碍。
　　【避错】精神分析疗法是对于潜意识和人格发展提出来的；人本主义疗法是让来访者处于治疗的中心地位，依靠调动来访者的自身潜力来治愈疾病；行为疗法是根据行为学习及条件反射理论，消除和纠正异常，并建立一种新的条件反射和行为的治疗方法；认知疗法是通过认知和行为技术来改变患者不良认知的治疗方法。",,A,家庭治疗,精神分析疗法,人本主义疗法,行为疗法,认知疗法,ATEST,43024705,,3,18,898,历年真题,历年真题,2017年真题第二单元
20世纪90年代。某地水源污染引发一起传染病爆发流行。在80万人的供水范围内。有40.3万人罹患经自来水传播的隐孢子病。此次突发公共卫生事件突出体现的特点是,"广泛人群在此次突发公共事件中受到影响，此为突发公共卫生事件的普遍性。
　　【避错】突发公共卫生事件是指突然发生，造成或者可能造成社会公众健康严重损害的重大传染病疫情、群体性不明原因疾病、重大食物和职业中毒以及其他严重影响公众健康的事件。其特点包括：突发性、普遍性、非常规性。",,B,局限性,普遍性,常规性,散发性,聚集性,ATEST,43024706,,3,18,898,历年真题,历年真题,2017年真题第二单元
男，45岁。平素体健。为抢救一外伤的幼儿献血100ml，如果不考虑交感/副交感神经兴奋性，最可能的血压，心率变化是,"献血200ml一般不会出现心率血压的改变。
　　【避错】一般在快速、大量（超过总血量的30%~35%）失血而不能及时纠正的情况下出现心率血压的变化。",,A,心率和血压均无明显变化,血压升高，心率加快,血压升高，心率减慢,血压降低，心率加快,血压降低，心率减慢,ATEST,43024707,,3,18,898,历年真题,历年真题,2017年真题第二单元
