Title,Explain,TestPoint,Answer,OptionA,OptionB,OptionC,OptionD,OptionE,StyleType,AllTestID,ATestID,SrcID,SbjID,CptID,章节名称,科目名称,试题名称
“无论是致病、治疗，还是预防和康复都应将人视为一个整体，需要考虑各方面因素的交互作用，而不能机械地将他们分割开”。此观点所反映的医学模式是,"生物-心理-社会医学模式是一种系统论和整体观的医学模式，他要求医学把人看成是一个多层次、完整的连续体，也就是在健康和疾病问题上，要同时考虑生物的、心理和行为的，以及社会的各种因素的综合作用。
　　【避错】医学模式又叫医学观，是人们考虑和研究医学问题时所遵循的总的原则和总的出发点即是人们从总体上认识健康和疾病以及相互转化的哲学观点。医学模式的演变：①神灵主义医学模式；②自然哲学的医学模式；③机械论的医学模式；④生物医学模式；⑤生物-心理-社会医学模式。",,B,自然哲学的医学模式,生物-心理-社会医学模式,神灵主义的医学模式,机械论医学模式,生物医学模式,ATEST,43024643,,3,18,898,历年真题,历年真题,2017年真题第二单元
关于青少年情绪、情感的特点，以下说法不正确的是,"青少年情感丰富且不稳定。青春期的发育不成熟，高级神经活动兴奋和抑郁过程的强弱与不平衡，往往表现为青年人易动感情、情感比较强烈，遇事容易激动，同时存在多种情绪状态。
　　【避错】青少年情绪的特点：①变化迅速，但不持久；②比较强烈，但相对脆弱；③容易冲动，缺乏理智控制；④敏感，多愁善感。",,E,情绪敏感,情绪反应强烈,情绪心境化,情感丰富,情绪稳定,ATEST,43024644,,3,18,898,历年真题,历年真题,2017年真题第二单元
选定暴露和未暴露于某种因素的两种人群，追踪其各自的发病结局，比较两者发病结局的差异，从而判断暴露因素与发病有无因果关联及关联程度，该研究为,"队列研究是将某一特定人群按是否暴露于某可疑因素或暴露程度分为不同的亚组，追踪观察两组或多组成员结局（如疾病）发生的情况，比较各组之间结局发生率的差异，从而判定这些因素与该结局之间有无因果关联及关联程度的一种观察性研究方法。从现在到将来属于队列研究。
　　【避错】①病例对照研究是比较患某病者与未患该病的对照者既往暴露于某个（或某些）可能危险因素的百分比差异，以判断这些因素与该病有无关联及关联程度大小的观察性研究方法。②临床试验指任何在人体（患者或健康志愿者）进行药物的系统性研究，以证实或揭示试验药物的作用、不良反应及（或）试验药物的吸收、分布、代谢和排泄，目的是确定试验药物的疗效与安全性。③现况研究是研究特定时点或时期与特定范围内人群中的有关变量（因素）与疾病或健康状况的关系，即是调查这个特定的群体中的个体是否患病和是否具有某些变量或特征的情况。",,C,病例对照研究,现场干预试验,队列研究,临床试验研究,现况研究,ATEST,43024645,,3,18,898,历年真题,历年真题,2017年真题第二单元
磷酸戊糖途径的主要产物之一是,"磷酸戊糖途径可产生大量的NADPH，为细胞的各种合成反应提供还原剂（力），比如参与脂肪酸和固醇类物质的合成。
　　【避错】磷酸戊糖途径是一个葡萄糖-6-磷酸经代谢产生NADPH和核糖-5-磷酸的途径。该途径包括氧化和非氧化两个阶段，在氧化阶段，葡萄糖-6-磷酸转化为核酮糖-5-磷酸和CO[XB2.gif]，并生成两分子的NADPH；在非氧化阶段，核酮糖-5-磷酸异构化生成核糖-5-磷酸或转化为酵解中的两个中间代谢物果糖-6-磷酸和甘油醛-3-磷酸。",,A,NADPH,FMN,CoQ,cAMP,ATP,ATEST,43024646,,3,18,898,历年真题,历年真题,2017年真题第二单元
血浆蛋白浓度降低所致水肿的原因是,"人体血浆浓度维持着人体组织液与血浆之间的渗透压平衡。当人体的血浆蛋白浓度降低时，就会出现组织液浓度大于血浆浓度，使血浆中的水分转移至组织液中，以降低组织液浓度使渗透压重新平衡。然而这样一来，就造成了组织水肿。
　　【避错】引起水肿的原因：血浆胶体渗透压降低；毛细血管内流体静压升高；毛细血管壁通透性增高；淋巴液回流受阻。",,A,血浆胶体渗透压降低,动脉血压升高,毛细血管壁通透性增加,淋巴回流量减少,组织液静水压升高,ATEST,43024647,,3,18,898,历年真题,历年真题,2017年真题第二单元
医疗机构使用非卫生技术人员从事医疗卫生技术工作应给予罚款处罚，其最高金额是,"《医疗机构管理条例》48条：违反本条例第28条规定，使用非卫生技术人员从事医疗卫生技术工作的，由县级以上人民政府卫生行政部门责令其限期改正，并可以处以5000元以下的罚款；情节严重的，吊销其《医疗机构执业许可证》。
　　【避错】本题记忆为主。",,A,5千元,8千元,2千元,1万元,3千元,ATEST,43024648,,3,18,898,历年真题,历年真题,2017年真题第二单元
医务人员必须经过省级卫生计生行政部门考核并取得相应合格证书方可从事的母婴保健服务项目是,"《中华人民共和国母婴保健法》第33条规定从事本法规定的遗传病诊断、产前诊断的人员，必须经过省、自治区、直辖市人民政府卫生行政部门的考核，并取得相应的合格证书。
　　【避错】从事本法规定的婚前医学检查、施行结扎手术和终止妊娠手术的人员以及从事家庭接生的人员，必须经过县级以上地方人民政府卫生行政部门的考核，并取得相应的合格证书。",,C,结扎手术,家庭接生,产前诊断,婚前医学检查,终止妊娠手术,ATEST,43024649,,3,18,898,历年真题,历年真题,2017年真题第二单元
与CO[XB2.gif]呼出量关系最密切的肺功能指标是,"肺泡通气量是指每分钟吸入或呼出肺泡的气体总量，它是与直接进行气体交换的有效通气量，是与CO[XB2.gif]呼出量关系最密切的肺功能指标。
　　【避错】①肺通气量指单位时间内出入肺的气体量。一般指肺的动态气量，它反映肺的通气功能，肺通气量可分为每分通气量、最大通气量、无效腔气量和肺泡通气量等。②肺活量是指一次尽力吸气后，再尽力呼出的气体总量，在一定意义上可反映呼吸机能的潜在能力。③最大通气量是指肺功能测定时，单位时间内所能呼吸的最大气量。④用力呼气量是指在一定的时间内一次最大吸气后再尽快尽力呼气所能呼出的气体量。",,C,肺通气量,肺活量,肺泡通气量,最大通气量,用力呼气量,ATEST,43024650,,3,18,898,历年真题,历年真题,2017年真题第二单元
属于乳腺癌特殊类型的是,"浸润性特殊型癌分为：乳头状癌、髓样癌（伴大量淋巴细胞浸润）、小管癌、腺样囊性癌、顶泌汗腺样癌、黏液腺癌、鳞状细胞癌、乳头Paget病等。
　　【避错】乳腺癌分为：非浸润性癌（小叶原位癌、导管内癌）、浸润性癌（浸润性特殊癌、浸润性非特殊癌）两类。其中浸润性非特殊型癌可分为：浸润性小叶癌、浸润性导管癌、硬癌、髓样癌（无大量淋巴细胞浸润）、单纯癌、腺癌等。",,D,浸润性导管癌,导管原位癌,浸润性小叶癌,小管癌,小叶原位癌,ATEST,43024651,,3,18,898,历年真题,历年真题,2017年真题第二单元
依据《侵权责任法》，医务人员实施手术前应当向患者说明的事项是,"医务人员在实施手术前应当向患者交代替代医疗方案。
　　【避错】《侵权责任法》第55条规定：“医务人员在诊疗活动中应当向患者说明病情和医疗措施。需要实施手术、特殊检查、特殊治疗的，医务人员应当及时向患者说明医疗风险、替代医疗方案等情况，并取得其书面同意；不宜向患者说明的，应当向患者的近亲属说明，并取得其书面同意。医务人员未尽到前款义务，造成患者损害的，医疗机构应当承担赔偿责任。”",,C,医疗纠纷处理方式,隐私保密要求,替代医疗方案,承担赔偿责任的情形,复印病例资料范围,ATEST,43024652,,3,18,898,历年真题,历年真题,2017年真题第二单元
有关同工酶概念的叙述，错误的是,"同工酶是指催化相同的化学反应，但其酶蛋白的分子结构、理化性质乃至免疫学性能等方面都存在一定差异的一组酶。
　　【避错】同工酶常由几个亚基组成，不同器官的同工酶谱不同，同工酶的理化性质、免疫学性质不同。",,D,同工酶常由几个亚基组成,不同器官的同工酶谱不同,同工酶的理化性质不同,同工酶催化不同的底物反应,同工酶的免疫学性质不同,ATEST,43024653,,3,18,898,历年真题,历年真题,2017年真题第二单元
不参与ADCC作用的免疫分子是,"补体不参与抗体依赖的细胞介导的细胞毒性作用。
　　【避错】抗体依赖的细胞介导的细胞毒性作用（ADCC）作用过程：IgG抗体与靶细胞表面的抗原决定簇特异性地结合；之后自然杀伤细胞（NK细胞）借助其表面相应的受体与结合在靶细胞上的IgG Fc段结合：活化的NK细胞释放穿孔素、颗粒酶等细胞毒物质杀伤靶细胞；靶细胞发生细胞凋亡，抗体被肝处理。",,A,补体,Fc受体,免疫球蛋白,颗粒酶,穿孔素,ATEST,43024654,,3,18,898,历年真题,历年真题,2017年真题第二单元
不会出现肉芽肿性病变的疾病是,"肉芽肿性病变是一种特殊的增生性病变，以肉芽肿形成为其特点，多为特殊类型的慢性炎症。细菌性痢疾为纤维素性炎，不出现肉芽肿性病变。
　　【避错】记忆口诀：“肉”体“结”合的“梅毒”和“血吸虫”很“伤”心。",,B,结节病,细菌性痢疾,结核病,血吸虫病,伤寒,ATEST,43024655,,3,18,898,历年真题,历年真题,2017年真题第二单元
有助于患者记忆的信息沟通方式不包括,"医患沟通时使用医学专业术语不利于患者理解记忆。
　　【避错】医患沟通时应避免强求沟通对象即时接受事实；避免使用易刺激对方情绪的语气和语言；避免过多使用对方不易听懂的专业词汇；避免刻意改变对方的观点，避免压抑对方的情绪。",,A,规范使用医学缩略术语,指导问题力求具体,重要医嘱首先提出,语言表达通俗易懂,归纳总结医嘱内容,ATEST,43024656,,3,18,898,历年真题,历年真题,2017年真题第二单元
相对于一般契约关系而言，医生在医患关系负有更重的义务，但这些义务中不包括,"医生应保护患者隐私，无披露义务。
　　【避错】在医患间契约关系中医生对患者有保密义务而非披露义务。",,C,监督义务,保密义务,披露义务,注意义务,忠实义务,ATEST,43024657,,3,18,898,历年真题,历年真题,2017年真题第二单元
关于经济因素对健康的影响，不正确的说法是,"人群收入的绝对水平并不能决定经济对健康的影响程度。
　　【避错】收入差距对健康的影响经济因素对人群健康的影响是多方面的，也是错综复杂的。一个社会中收入的公平性决定了社会经济状况对健康的影响程度。",,C,经济因素对健康的影响是多方面的,单纯注重经济增长将危害人类的健康,人群收入的绝对水平决定着经济对健康的影响程度,经济的发展应与社会发展及促进人类健康水平同步,人群的健康水平影响经济的发展,ATEST,43024658,,3,18,898,历年真题,历年真题,2017年真题第二单元
符合早期胃癌诊断条件的是,"癌组织未累及肌层的胃癌均为早期胃癌。
　　【避错】癌组织浸润仅限于黏膜层及黏膜下层者均属早期胃癌，判断早期胃癌的标准不是其面积的大小和是否有局部淋巴结转移，而是其深度。",,B,肿瘤仅限于胃窦,癌未累及肌层,肿瘤直径小于0.5cm,黏膜皱襞消失,肿瘤直径小于1cm,ATEST,43024659,,3,18,898,历年真题,历年真题,2017年真题第二单元
α-酮酸可转变生成的物质是,"α-酮酸可经三羧酸循环彻底氧化成CO[XB2.gif]和H[XB2.gif]O，并释放能量。
　　【避错】α-酮酸的去路包括：①生成非必须氨基酸；②氧化成CO[XB2.gif]和H[XB2.gif]O，生成ATP；③转化成糖和脂类化合物。",,A,CO[XB2.gif]和H[XB2.gif]O,营养必须脂肪酸,维生素A,营养必须氨基酸,维生素E,ATEST,43024660,,3,18,898,历年真题,历年真题,2017年真题第二单元
用酒精给高热患者擦浴的散热方式是,"酒精的沸点低，蒸发快，可以通过蒸发带走热量达到散热的目的，属于蒸发散热。
　　【避错】①传导散热是指机体的热量直接传给与之接触的温度较低物体的一种散热方式。临床上更为常用的冰袋降温属于传导散热。②辐射散热是指人体以热射线的形式将体热传给外界较冷物质的一种散热方式。③对流散热是指通过气体流动进行热量交换的一种散热方式。④不感蒸发是指体液的水分从皮肤和黏膜（主要是呼吸道黏膜）表面不断渗出而被汽化的形式。",,A,蒸发散热,辐射散热,不感蒸发散热,传导散热,对流散热,ATEST,43024661,,3,18,898,历年真题,历年真题,2017年真题第二单元
负责向社会发布突发公共卫生事件信息的法定单位是,"国务院卫生计生部门的新闻发布人负责向社会发布突发公共卫生事件信息。
　　【避错】《突发公共卫生事件应急条例》第25条，国家建立突发事件的信息发布制度，国务院卫生行政主管部门负责向社会发布突发事件的信息。必要时，可以授权省、自治区、直辖市人民政府卫生行政主管部门向社会发布本行政区域内突发事件的信息。",,C,县级人民政府,省级人民政府,国务院卫生计生行政部门,国务院新闻办公室,设区的市级人民政府,ATEST,43024662,,3,18,898,历年真题,历年真题,2017年真题第二单元
琥珀酸氧化呼吸链不含有的组分是,"琥珀酸氧化呼吸链不含有FMN，它属于NADH氧化呼吸链中的成分。
　　【避错】两条呼吸链的排列顺序：①NADH氧化呼吸链：NADH→FMN→Fe-S→CoQ→Cyt b→Fe-S→Cyt c[XB1.gif]→Cyt c→Cu[XBA.gif]→Cyt a→Cu[XBB.gif]→Cyt a[XB3.gif]→O[XB2.gif]。②琥珀酸氧化呼吸链（FADH氧化呼吸链）：琥珀酸→FAD→Fe-S→CoQ→Cyt b→Fe-S→Cyt c[XB1.gif]→Cyt c→Cu[XBA.gif]→Cyt a→Cu[XBB.gif]→Cyt a[XB3.gif]→O[XB2.gif]。",,A,FMN,CoQ,Cyt c,Cyt b,Cyt C[XB1.gif],ATEST,43024663,,3,18,898,历年真题,历年真题,2017年真题第二单元
属于医务人员自我道德评价方式的是,"信念的自我评价是人们依照某种观念、原则和理想等形成的信念，对自己的医疗行为自觉做出医德上的自我肯定或否定。内心信念是医务人员自我道德评价方式。
　　【避错】医学道德的评价方法有：社会舆论、传统习俗和内心信念。",,B,慎独,内心信念,传统习俗,名誉,社会舆论,ATEST,43024664,,3,18,898,历年真题,历年真题,2017年真题第二单元
抗菌药物的细菌耐药率超过一定的百分比时，慎重经验用药，该百分比是,"细菌的耐药性>40%时，应当慎重经验用药。
　　【避错】医疗机构应当开展细菌耐药监测工作，建立细菌耐药预警机制：①主要目标细菌耐药率>30%的抗菌药物，应当将预警信息通报本机构医务人员；②主要目标细菌耐药率>40%的抗菌药物，应当慎重经验用药；③主要目标细菌耐药率>50%的抗菌药物，应当参照药敏试验结果选用；④主要目标细菌耐药率>75%的抗菌药物，应当暂停针对此目标细菌的临床应用。",,D,50%,20%,10%,40%,30%,ATEST,43024665,,3,18,898,历年真题,历年真题,2017年真题第二单元
临床预防服务的主要内容不包括,"临床预防服务的内容主要是疾病的预防和制定健康教育计划，而非药物治疗。
　　【避错】临床预防服务的内容包括：①求医者的健康咨询；②健康筛检；③免疫接种；④化学预防。",,E,化学预防,筛查,健康咨询,免疫接种,药物治疗,ATEST,43024666,,3,18,898,历年真题,历年真题,2017年真题第二单元
帕金森病患者可出现症状是,"帕金森病属于锥体外系病变，主要导致肌张力增高、患者出现静止性震颤，这是其最典型的表现。
　　【避错】意向性震颤见于小脑病变。运动共济失调为脊髓小脑束受损表现。",,A,静止性震颤,意向性震颤,运动共济失调,骨骼肌张力降低,皮肤感觉迟钝,ATEST,43024667,,3,18,898,历年真题,历年真题,2017年真题第二单元
目前我国提倡的活体供体器官获取的方式是,"器官移植和献血都提倡自愿。
　　【避错】在我国，买卖人体器官是违法行为。",,C,自由买卖,推定同意,自愿捐献,家属决定,医生强制,ATEST,43024668,,3,18,898,历年真题,历年真题,2017年真题第二单元
医生在诊疗过程中经常对患者使用医学专业术语，使患者难以理解，容易造成误解。这种医患交流的问题属于,"医学专业由于专业性强，晦涩难懂，不能被患者所理解，导致医患之间沟通障碍。
　　【避错】医患沟通时避免过多使用对方不易听懂的专业词汇，设想一个阑尾炎患者，你如果问他麦氏点有没有压痛，会让人哭笑不得。",,B,回忆不良,沟通障碍,信息缺乏,同情不够,依从性差,ATEST,43024669,,3,18,898,历年真题,历年真题,2017年真题第二单元
医患关系的实质是,"医患关系是建立在平等基础上的契约关系；医患关系是以社会主义法制为保障建立起来的信托关系。
　　【避错】医患关系是医务人员与患者在医疗过程中产生的特定医治关系，其本质是具有契约性质的信托关系。",,B,具有经济性质的商业关系,具有契约性质的信托关系,具有法律性质的契约关系,具有市场性质的交换关系,具有宗教性质的文化关系,ATEST,43024670,,3,18,898,历年真题,历年真题,2017年真题第二单元
免疫标记降钙素阳性的甲状腺肿瘤是,"甲状腺髓样癌是起源于甲状腺滤泡旁分泌细胞的恶性肿瘤，90%的肿瘤分泌降钙素。术前检查降钙素大于100ng/L，基本可以诊断为甲状腺髓样癌。
　　【避错】降钙素是甲状腺的滤泡旁细胞产生和分泌，主要生理功能是降低血钙、血磷的水平，其增高对起源于滤泡旁细胞的甲状腺髓样癌的诊断、判断手术疗效和观察术后复发等有重要意义。",,C,梭形细胞癌,滤泡腺癌,髓样癌,巨细胞癌,乳头状癌,ATEST,43024671,,3,18,898,历年真题,历年真题,2017年真题第二单元
即可通过水平传播，也可通过垂直传播的疾病是,"乙型肝炎既可以母亲传给儿女（垂直传播），又可以传给其他人（水平传播）。
　　【避错】病毒的传播方式有水平传播和垂直传播两种，前者是指病毒在人群个体之间的传播，后者是指病毒从母体经过胎盘或产道传染给胎儿的传播。通过垂直传播和母婴传播疾病主要是艾滋病、乙肝和梅毒。",,E,麻疹,流行性感冒,流行性脑脊髓膜炎,甲型肝炎,乙型肝炎,ATEST,43024672,,3,18,898,历年真题,历年真题,2017年真题第二单元
吗啡和哌替啶的共同作用不包括,"吗啡和哌替啶都是阿片受体激动剂，主要具有以下特点：①通过模拟内源性抗痛物质脑啡肽的作用，激动中枢神经阿片受体而产生强大的镇痛作用。②在镇痛的同时有明显的镇静作用，改善疼痛患者的紧张情绪。⑧可抑制呼吸中枢。④可抑制咳嗽中枢，产生镇咳作用。⑤可兴奋平滑肌，使肠道平滑肌张力增加而导致便秘，可使胆道、输尿管、支气管平滑肌张力增加。⑥可促进内源性组织胺释放而导致外周血管扩张、血压下降，脑血管扩张、颅内压增高。⑦有镇吐、缩瞳等作用。⑧长期使用可产生依赖性。
　　【避错】哌替啶不能止泻，阿托品可止泻。",,B,体位性低血压,止泻,抑制呼吸,镇痛,成瘾性,ATEST,43024673,,3,18,898,历年真题,历年真题,2017年真题第二单元
某心理治疗师婉拒了一位正在接受其治疗的患者请其吃饭的邀请。该心理治疗师的这一行为所遵循的心理治疗原则是,"关系限定原则指心理治疗师在临床工作中应该按照本专业的道德规范与患者建立良好的治疗关系。不得利用患者对医生的信任或依赖谋取私利，不得与患者发展专业工作以外的关系。
　　【避错】心理治疗医患之间的相处原则还包括：患者资料要保密，问两个对立的问题要中立，看见亲属就回避，对待患者要真诚。",,B,保密原则,关系限定原则,真诚原则,客观中立原则,回避原则,ATEST,43024674,,3,18,898,历年真题,历年真题,2017年真题第二单元
计算患病率的分子是,"患病率也称现患率，是指某特定时间内总人口中某病新旧病例所占比例。
　　【避错】患病率的分子为特定时间一定人群中某病新旧病例数，不管它是新发病还是旧病，只要是特定时间内疾病尚未痊愈，就记为病例数。发病率的分子为一定期间暴露人群中新病例人数。",,B,观察期间某病的暴露人口数,观察期间某病的新旧病例数,观察期间某病的新发病例数,观察开始之前某病的患病人数,观察期间所有人口数,ATEST,43024675,,3,18,898,历年真题,历年真题,2017年真题第二单元
Ⅱ型超敏反应导致的疾病是,"Ⅱ型超敏反应又称细胞溶解型变态反应或细胞毒型变态反应。细胞上的抗原与抗体结合时，由于补体、吞噬细胞或K细胞的作用，细胞被破坏。例如血型不符的输血反应，新生儿溶血反应和药物引起的溶血性贫血都属于Ⅱ型超敏反应。
　　【避错】变态反应按免疫机制的不同可分为四类，即Ⅰ型变态反应、Ⅱ型变态反应、Ⅲ型变态反应、Ⅳ型变态反应。Ⅰ型超敏反应又称过敏性变态反应，血清过敏性休克、食物过敏性腹泻、花粉过敏性哮喘均属于Ⅰ型超敏反应：接触性皮炎属于Ⅳ型超敏反应。",,B,青霉素过敏性休克,新生儿溶血病,接触性皮炎,食物过敏性腹泻,花粉过敏性哮喘,ATEST,43024676,,3,18,898,历年真题,历年真题,2017年真题第二单元
关于流行病学，下列说法正确的是,"流行病学是研究人群中疾病与健康状况的分布及其影响因素，并研究防治疾病及促进健康的策略和措施的科学。
　　【避错】流行病学特点如下。①研究对象是人群；②关注的事件包括疾病与健康状况；③研究的内容包括揭示现象、找出原因、提供措施、评价效果；④目的是防治疾病、促进健康。",,C,从个体的角度研究疾病和健康状况分布及其影响因素,侧重研究传染病的流行特征和防治措施,研究人群中疾病和健康状况的分布及其影响因素,只研究疾病的防治措施,侧重研究慢性病的危险因素,ATEST,43024677,,3,18,898,历年真题,历年真题,2017年真题第二单元
在继发性主动转运过程中，驱动小管液葡萄糖进入肾小管上皮细胞的直接动力是,"继发性主动转运不直接消耗能量，但是需要依赖主动转运所形成的浓度差，故葡萄糖继发性主动转运的直接动力为细胞膜两侧的钠离子的浓度差。
　　【避错】继发性主动转运的原动力来自ATP分解，即功能磷酸键释放的能量。",,B,膜内外两侧的电位差,钠泵活动造成的膜两侧Na[SBjia.gif]浓度差,泵蛋白水解ATP释放的能量,由同向转入细胞的物质提供能量,同向转运体水解ATP释放的能量,ATEST,43024678,,3,18,898,历年真题,历年真题,2017年真题第二单元
适用于“主动-被动型”医患关系模式的患者群体中一般不包括,"慢性焦虑患者属于慢性病，医患双方需要实施共同合作模式来治疗。
　　【避错】主动—被动型医患关系模式主要用于急危重患者：如昏迷、休克的患者；其次无自主能力的患者也需要主动—被动型医患关系模式，A、B、D选项中的患者适用主动—被动型医患关系模式。",,C,昏迷患者,婴幼儿患者,焦虑症患者,痴呆患者,精神分裂症缺乏自知力患者,ATEST,43024679,,3,18,898,历年真题,历年真题,2017年真题第二单元
